{
  "Cost_parameters": {
    "x_load": 2000,
    "x_primary_APR_up": 10000,
    "x_primary_APR_down": 10000,
    "x_secondary_APR_up": 5000,
    "x_secondary_APR_down": 5000,
    "x_tertiary_APR_up": 3000,
    "x_tertiary_APR_down": 3000,
    "x_forbidden_zones": 50000,
    "x_ramp": 10000,
    "x_must_run": 100000,
    "x_min_transition_oper_states_a": 10000,
    "x_min_transition_oper_states_a_left": 10000,
    "x_min_transition_oper_states_b": 10000,
    "x_min_transition_oper_states_b_left": 10000,
    "x_max_oper_state_time_b": 10000,
    "x_max_oper_state_time_b_left": 10000,
    "x_min_transition_states": 10000,
    "x_min_transition_states_left": 10000,
    "x_Grid_Capacity": 10000,
    "x_testing_mode": 10000,
    "x_RES_PV_power_plus": 100000,
    "x_RES_PV_power_minus": 100000,
    "x_OOS_more_than": 10000,
    "x_OOS_less_than": 10000
  },
  "Other_coefficients": {
    "primary_upwards": [[1, 1.5], [30, 0.15], 5, 0.03],
    "primary_downwards": [[1, 0.02], [0.05, 0.15], 5, 0.04],
    "secondary_upwards": [[2, 0.02], [0.05, 0.15], 0.044, 0.03],
    "secondary_downwards": [[2, 0.1], [0.05, 0.15], 7, 4],
    "tertiary_upwards": [[2, 0.02], [0.05, 0.15], 0.034, 0.025],
    "tertiary_downwards": [[2, 0.1], [0.05, 0.15], 7, 4],
    "x_res_pv_dynamic": 0.35,
    "include_PV": 1,
    "PV_dispatch_method": 0,
    "PV_Participation_coefficient": 50
  },
  "constraints": {
    "min_max_constraint": true,
    "load_production_balance_constraint": true,
    "operating_states_min_transition_time_between_states_constraint_a": false,
    "operating_states_min_transition_time_between_states_constraint_b": false,
    "operating_states_max_transition_time_between_states_constraint_b": true,
    "state_min_time_constraint": false,
    "APRR_calculations": {
                          "calculation-method_upwards": [[1, 1], [0, 1], 0, 0],
                          "calculation-method_downwards": [[1, 1], [0, 1], 0, 0]
    },
    "primary_active_power_reserves_constraint": true,
    "secondary_active_power_reserves_constraint": true,
    "tertiary_active_power_reserves_constraint": true,
    "ramp_up_down_constraints": true,
    "forbidden_zones_constraint": true,
    "must_run_units_constraint": true,
    "allowed_thermal_states_transition_constraints": true,
    "res_pv_dispatch_variables_constraints": true,
    "testing_mode_constraints": false,
    "OOS_mode_constraints": false
  },
  "optimization_parameters": {
    "solver": "highs",
    "require_optimal": true,
    "big_m": "auto",
    "cost_curve_time_unit": "euro_per_mw_per_minute",
    "highs_options": {
      "user_objective_scale": -4
    },
    "early_stopping": {
      "time_limit": null
    }
  },
  "Generating_Units": [
    {
      "gen_id": 0,
      "agc_configuration": {
        "isConnected": 1,
        "maxLoad": 16.491,
        "minLoad": 8.5
      },
      "mustRun": [0, 0, 0, 0, 1, 1, 0, 0, 0, 0, 0, 0, 0, 0, 0, 0, 0, 0, 0, 0, 0, 0, 0, 0],
      "testing_mode_enabled": [0, 0, 0, 0, 0, 0, 0, 0, 0, 0, 0, 0, 0, 0, 0, 0, 0, 0, 0, 0, 0, 0, 0, 0],
      "power_production_in_testing_mode": [0, 0, 0, 0, 0, 0, 0, 0, 0, 0, 0, 0, 0, 0, 0, 0, 0, 0, 0, 0, 0, 0, 0, 0],

      "OOS_mode_less_than_enabled": [1, 0, 0, 0, 0, 0, 0, 0, 0, 0, 0, 0, 0, 0, 0, 0, 0, 0, 0, 0, 0, 0, 0, 0],
      "power_production_in_OOS_mode_less_than": [14, 0, 0, 0, 0, 0, 0, 0, 0, 0, 0, 0, 0, 0, 0, 0, 0, 0, 0, 0, 0, 0, 0, 0],

      "OOS_mode_more_than_enabled": [1, 0, 0, 0, 0, 0, 0, 0, 0, 0, 0, 0, 0, 0, 0, 0, 0, 0, 0, 0, 0, 0, 0, 0],
      "power_production_in_OOS_mode_more_than": [14, 0, 0, 0, 0, 0, 0, 0, 0, 0, 0, 0, 0, 0, 0, 0, 0, 0, 0, 0, 0, 0, 0, 0],


      "forbidden_zones": [[10, 16]],
      "comments": "Thermo: RODOS Thermal Power Station 40 - 1",
      "Production_Forecast": [0, 0, 0, 0, 0, 0, 0, 0, 0, 0, 0, 0, 0, 0, 0, 0, 0, 0, 0, 0, 0, 0, 0, 0],
      "max_power(MW)": 17.491,
      "min_power(MW)": 8.5,
      "ramp_up_rate(kW/min)": 1000,
      "ramp_down_rate(kW/min)": 1000,
      "current_Power(MW)": 0,
      "availability": [15.7, 16.491, 16.491, 16.491, 16.491, 16.491, 16.491, 16.491, 16.491, 16.491, 16.491, 16.491, 16.491, 16.491, 16.491, 16.491, 16.491, 16.491, 16.491, 16.491, 16.491, 16.491, 16.491, 16.491],
      "var_gen_cost(euro/MW)": [
        [
          8.5,
          10,
          14.5,
          17.491
        ],
        [
          2.35,
          2.45,
          2.55,
          2.65
        ]
      ],
      "cost_curve_source": {
        "type": "manual_pwl",
        "reference": "Project biomass test-case thermal cost assumptions",
        "currency": "EUR",
        "basis": "euro_per_mw_per_minute",
        "method": "incremental_breakpoints_and_marginal_slopes"
      },
      "start_up_cost(euro)": 1600,
      "shut_down_cost(euro)": 900,
      "state": 0,
      "Primary_Active_Power_Reserves(MW)": [
        1.7,
        1.7
      ],
      "Secondary_Active_Power_Reserves(MW)": [
        4,
        4
      ],
      "Tertiary_Active_Power_Reserves(MW)": [
        15,
        15
      ],
      "Primary_APR_Cost(euro/MW)": [
        0,
        0
      ],
      "Secondary_APR_Cost(euro/MW)": [
        0,
        0
      ],
      "Tertiary_APR_Cost(euro/MW)": [
        0,
        0
      ],
      "operating-states": [
        {
          "id": 0,
          "min-power": 0,
          "max-power": 0,
          "enabled-cost": 0,
          "isShutdown": true,
          "isEnabled": true,
          "isOperational": false
        },
        {
          "id": 1,
          "min-power": 0,
          "max-power": 0,
          "enabled-cost": 5,
          "isShutdown": true,
          "isEnabled": false,
          "isOperational": false
        },
        {
          "id": 2,
          "min-power": 0,
          "max-power": 0,
          "enabled-cost": 10,
          "isShutdown": true,
          "isEnabled": false,
          "isOperational": false
        },
        {
          "id": 3,
          "min-power": 1.6,
          "max-power": 8.5,
          "enabled-cost": 15,
          "isShutdown": false,
          "isEnabled": false,
          "isOperational": false
        },
        {
          "id": 4,
          "min-power": 8.5,
          "max-power": 17.491,
          "user_max_power": 17.2,
          "user_min_power": 9,
          "enabled-cost": 0,
          "isShutdown": false,
          "isEnabled": false,
          "isOperational": true
        },
        {
          "id": 5,
          "state_role": "desynchronization",
          "min-power": 1.6,
          "max-power": 8.5,
          "enabled-cost": 15,
          "isShutdown": false,
          "isEnabled": false,
          "isOperational": false
        }
      ],
       "state-transitions": [
        {
          "from": 0,
          "transitions":
            {
              "value": 1,
              "min-transition-time": 0
            }
        },
        {
          "from": 1,
          "transitions":
            {
              "value": 0,
              "min-transition-time": 0,
              "min-transition-time-left": 0
            }
        }
        ],
      "operating-state-transitions": [
        {
          "from": 0,
          "transitions": [
            {
              "id": 3,
              "transition-cost": 800,
              "min-transition-time_a": 30,
              "min-transition-time_b": 24,
              "min-transition-time-left_a": 300
            }
          ]
        },
        {
          "from": 1,
          "transitions": [
            {
              "id": 0,
              "transition-cost": 0
            },
            {
              "id": 3,
              "transition-cost": 400,
              "min-transition-time_a": 6,
              "min-transition-time_b": 12
            }
          ]
        },
        {
          "from": 2,
          "transitions": [
            {
              "id": 1,
              "transition-cost": 0
            },
            {
              "id": 3,
              "transition-cost": 200,
              "min-transition-time_a": 6,
              "min-transition-time_b": 12
            }
          ]
        },
        {
          "from": 3,
          "transitions": [
            {
              "id": 4,
              "transition-cost": 0,
              "max-transition-time_b": 300
            }
          ]
        },
        {
          "from": 4,
          "transitions": [
            {
              "id": 5,
              "transition-cost": 100,
              "min-transition-time_a": 180
            }
          ]
        },
        {
          "from": 5,
          "transitions": [
            {
              "id": 2,
              "transition-cost": 0
            }
          ]
        }
      ]
    },
    {
      "gen_id": 1,
      "agc_configuration": {
        "isConnected": 1,
        "maxLoad": 18.000,
        "minLoad": 5.5
      },
      "mustRun": [0, 0, 0, 0, 0, 0, 0, 0, 1, 0, 0, 0, 0, 0, 0, 0, 0, 0, 0, 0, 0, 0, 0, 0],
      "testing_mode_enabled": [0, 0, 0, 0, 0, 0, 0, 0, 0, 0, 0, 0, 0, 0, 0, 0, 0, 0, 0, 0, 0, 0, 0, 0],
      "power_production_in_testing_mode": [0, 0, 0, 0, 0, 0, 0, 0, 0, 0, 0, 0, 0, 0, 0, 0, 0, 0, 0, 0, 0, 0, 0, 0],

      "OOS_mode_less_than_enabled": [0, 0, 0, 0, 0, 0, 0, 0, 0, 0, 0, 0, 0, 0, 0, 0, 0, 0, 0, 0, 0, 0, 0, 0],
      "power_production_in_OOS_mode_less_than": [0, 0, 0, 0, 0, 0, 0, 0, 0, 0, 0, 0, 0, 0, 0, 0, 0, 0, 0, 0, 0, 0, 0, 0],

      "OOS_mode_more_than_enabled": [0, 0, 0, 0, 0, 0, 0, 0, 0, 0, 0, 0, 0, 0, 0, 0, 0, 0, 0, 0, 0, 0, 0, 0],
      "power_production_in_OOS_mode_more_than": [0, 0, 0, 0, 0, 0, 0, 0, 0, 0, 0, 0, 0, 0, 0, 0, 0, 0, 0, 0, 0, 0, 0, 0],

      "forbidden_zones": [[12, 14]],
      "comments": "Thermo: RODOS Thermal Power Station 4 - 30",
      "Production_Forecast": [0, 0, 0, 0, 0, 0, 0, 0, 0, 0, 0, 0, 0, 0, 0, 0, 0, 0, 0, 0, 0, 0, 0, 0],
      "max_power(MW)": 18.500,
      "min_power(MW)": 4.0,
      "ramp_up_rate(kW/min)": 1000,
      "ramp_down_rate(kW/min)": 2000,